,top_terms
0,#glutenfree #healthy #wellness #healthyfood #foodie #foodblogger #healthyinspo #healthylife #plantpower #fitness #healthymeals #cleaneats #thenewhealth #paleo #grainfree #foodgrams #mbg #thefeedfeed #whatveganseat add salt sea #vegan minutes #vegans roasted oil cook bowl cup #plantbased powder curry #vegetarian olive diced hope recipe week good onion cauliflower soft kale red coconut sunflower heat weekend happy
1,hair body wear look skin clothes legs wearing use hands eyes size face used hot blood cute dress jeans looks water cold cut muscles fit hold wash warm inside arms feet clean pain dry mask pair bones comfortable pants red light bought room times side old clothing thigh pick shoes
2,food eat cream cake ice good eating pizza chocolate dinner coffee breakfast meal ate lunch tea bread vegan night today day drink meals free cheese big dessert local delicious fruit foods eaten enjoy favorite buy evening wine cleveland full slice order eggs shop baked cookies cookie drinks sweet best grocery
3,eating support alliance disorders please help #edrecovery recovery disorder #notonemore #allianceforeda link com mental national day #recovery call awareness today visit individuals health community #mentalhealth free #yourpathtorecovery allianceforeatingdisorders thank hope struggling groups #findedhelp bio conversation #eatingdisorderrecovery resources join #eatingdisorders #recoveryispossible #eatingdisorder care need loved services alone reach watch led #quoteoftheweek
4,therapy feel really things session time question get answer want week therapist bit talk going see still need even back way ok go last talking felt maybe good got asked end thought right thing able trying hard mum tell try quite lot keep might told though away wanted never feeling
5,sweet bowl cheese oil roasted sauce avocado garlic pasta water meal potato rice salt veggies used add hummus vegan cream sea minutes dressing tbsp dinner cook lunch toast spinach tahini salad olive favorite cup recipe ingredients potatoes cooked together slices plate meals always veggie kale eggs squash quinoa green egg
6,year love family years friends day christmas happy new birthday book today thank holiday sister little old friend mom ago summer home ever grateful favorite season reading read beautiful dylan dad fun amazing girl together special since lovely night full girls celebrate holidays spent last play story came money dream
7,body see way look photos real day happy bodies monday good self image skin week beauty comments online beautiful someone different photo change positive media enough start cellulite post #bodyimage leave looks healthy less thoughts appearance ever #expectationvsreality #instagramvsreality please else mirror negative today bad social belly #selflove first rolls
8,life feel things time love people want even get way really always need take still go never best going right let good self lot feeling see hard thing world back better live person past find keep around look years care okay someone change important everything remember mind days new sometimes
9,cup chocolate butter add tbsp flour mix ingredients powder #glutenfree bake #healthyfood coconut vanilla batter pinch salt #healthy minutes set #foodie #foodblogger #healthyinspo recipe #healthylife baking vegan #healthymeals let maple sea bowl pan loaf almond #plantpower peanut syrup sugar oil blend chips cookie smooth milk oven #foodgrams #chocolate #thefeedfeed dough
10,oats butter milk bowl protein almond seeds frozen topped chocolate yogurt smoothie peanut cacao morning banana breakfast vanilla tbsp chia cup powder coconut syrup blueberries overnight maple pumpkin cinnamon nibs granola code oatmeal greek rice pancakes use usa mix apple recipe maca nuzest water pb used strawberries flax kitehillfoods radiance
11,eating body food eat weight healthy health calories foods diet disorder day binge meals exercise gain less needs fat lose hunger control full culture meal hungry number loss ate enjoy bodies etc recovery freedom energy physical bad used lost yes certain guilt unhealthy workout disordered amount lifestyle balance low longer
12,people ur question answer bc lol shit recovery blog post money pro see ass thank ppl sorry rly fucking wanna posts ed tumblr tags skinny ana lmao gonna literally follow hey tag stop blogs got urself wish fuck bitch man nobody ok please ever kinda reblog ya plants rn idk
13,plant work based yoga purpose vegan help bio actually share program health practice start nutrition women send coaching learn link big dm living path heart support month clients questions got ready started part sure amanda free dietitian information drop use next lifestyle inner possible stuck school etc apply confidence page
14,date protein code free solo giveaway macrmike bree tag new give post share use enter order comments ad products enjoy winner range follow choc recipes pm friend love day mug amb macro posted #ad story gift cookies using section routine fun perfect win reels #selfcare leave set save easy dates
15,feel get recovery want really even ed time still need going go good life fucking trying better bad shit back never hard keep people fuck gonna work help okay eat anything try sick always actually enough take way getting ever someone right feeling nothing thing everything sometimes literally brain anyone
16,trauma disorder self eating white xa brain recovery pain treatment help god comment words people use tree shame html disorders privilege experiences women behaviors voice coping black sense believe harm angry actually hate depression anxiety compassion trying attachment world healing protect monster racism safe girl sexual towards center system symptoms
17,guys day new video time get definitely vegan holly go week first year see going vlog back bit want even yes love last got ever really today always right never please big ok best still happy thank live hope ps let next lot friends pretty sure try full super uk
18,day today time home good get morning got last week days back night go going really went bed hours first sleep run friends happy work weekend yesterday long rest since school next tomorrow little feeling weeks hour felt minutes walk getting busy took room running new start great ready later
19,tree comment html #vegan #veganfood #girl #plantbased #fitness #compassion #crueltyfree #nature #healthy #carbs #raw #hclf #rawtil #freeleethebananagirl #veganfitness #lowfat #rt #freelee #veganism #carbthefuckup #love #edrecovery #foodshare #bananagirl #vegangains #veganpower #fruitbats #ctfu #highcarblowfat xa #vegansofig #healthynotskinny #photography #strongnotskinny #frugivore #frugitarian #gofruityourself #fruitaddict #bananagirldiet memes art instagram positive wrote bending zuko talent
20,question answer school baby people uk hospital family parents babies children still foster covid different social treatment care unit allowed yes staff home kids inpatient group months child vaccine year old patients age lockdown contact team pandemic news due schools groups sure stay etc state test long weeks doctor birth
