,top_terms
0,self take world feeling work years best hard care lot days live change year past new person happy better health come thing hope sometimes living help taking someone keep okay remember feels everything enough trying little find else share place grateful long mind around able everyone maybe thought times important
1,guys new video first vegan definitely year holly ever last happy best yes vlog bit thank big full please friends live hope fun amazing ok pretty lot sure ps next youtube super uk little food home excited photo oh videos watch running try actually yesterday honestly link coming post find
2,cup chocolate tbsp butter add flour mix ingredients powder #glutenfree vanilla #healthyfood coconut bake #healthy batter pinch #foodie minutes salt recipe #healthyinspo #foodblogger #healthylife set #healthymeals peanut baking bowl sea #plantpower maple vegan almond loaf pan syrup sugar milk cookie oil chips blend #foodgrams cinnamon banana #wellness #thefeedfeed #chocolate dough
3,eating support alliance disorders please help recovery disorder #edrecovery #notonemore mental #allianceforeda com #recovery link national community health call awareness free individuals visit #mentalhealth #yourpathtorecovery thank allianceforeatingdisorders groups struggling hope bio #findedhelp conversation #eatingdisorderrecovery resources care #eatingdisorders loved join #recoveryispossible #eatingdisorder watch alone services led head reach #quoteoftheweek register virtual
4,recovery ed shit fucking ur fuck gonna lol bc ever someone literally hate try ass keep anyone wanna trying anything help care idk take sick sorry stop bad blog give better money everything actually ill nothing post art gotta put everyone else pro please cool god enough wish already thank
5,#glutenfree #healthy #foodie #healthyfood #foodblogger #wellness #healthyinspo #healthylife #plantpower #healthymeals #fitness #cleaneats #thenewhealth bowl add #paleo salt #grainfree oil roasted sea minutes #foodgrams #mbg cup #whatveganseat #thefeedfeed cook olive powder garlic #vegan #vegans vegan tbsp water recipe sweet hummus kale diced maple #plantbased curry yogurt #vegetarian avocado used red onion
6,therapy session talk therapist bit talking ok maybe felt last thing asked thought end hard trying brain tell told years parents able feeling yes work sometimes lot might mum try quite help though keep child feels away wanted stuff different part first sure talked started next adult enough difficult feelings
7,#vegan #nature #plantbased #fitness #healthy #veganfood #girl #compassion #crueltyfree white #carbs #raw #hclf #rawtil #freeleethebananagirl #veganfitness #lowfat #rt #freelee #veganism #carbthefuckup #love #edrecovery #foodshare #bananagirl #vegangains #veganpower #fruitbats #ctfu #highcarblowfat #vegansofig #strongnotskinny #photography #healthynotskinny #frugivore #frugitarian #gofruityourself #fruitaddict #bananagirldiet privilege black racism monster vote racist race fire stand dirty death
8,eating food eat body weight healthy disorder foods recovery health calories diet binge lot meals ate bad without exercise meal gain days less hungry feeling better lose trying thing brain fat okay keep needs control normal ed enough hunger hard culture enjoy loss full number look sometimes actually stop matter
9,body look photos real skin bodies happy image self monday comments someone beautiful wear beauty change looks online healthy size different start post positive mirror ever thing enough media thoughts photo else cellulite appearance #bodyimage leave comfortable mind less hope legs wearing negative fit please best clothes human belly #expectationvsreality
10,plant free based protein use code date vegan solo giveaway favorite coffee tag new post #ad recipes macrmike give enjoy bree share products using skin fun save order link follow try cookies enter nutrition dairy comments pm mug range stories ad perfect gift friend choc shop check book delicious winner
11,bowl breakfast cream chocolate butter eat frozen milk topped almond food cheese protein meal ice morning sweet oats smoothie rice banana dinner lunch peanut egg pizza avocado eggs seeds eating bread sauce pasta coconut potato favorite best toast happy fruit veggies recipe vegan vanilla plate pancakes half cacao chia fresh
12,home last morning night school went days work bed hours run sleep getting house friends baby family little first long though since tomorrow weekend weeks feeling new room rest around yesterday great bit evening take minutes done felt pretty taking hour inpatient took walk couple away later running early happy
