,top_terms
0,cup chocolate butter tbsp add bowl mix vanilla glutenfree powder almond healthy coconut milk recipe flour healthyfood peanut vegan banana ingredients foodie foodblogger healthyinspo healthylife healthymeals baking protein salt maple oats plantpower syrup minutes sea batter bake pinch wellness set pumpkin let cinnamon foodgrams fitness cacao thefeedfeed cleaneats loaf thenewhealth
1,life time feel like love things know people day way even get one take make much want feeling today going self something really good hard back would always work go think body see right never need best every years new let care past days happy still others year little lot
2,healthy bowl foodie healthyfood glutenfree wellness foodblogger healthyinspo roasted oil add healthylife vegan fitness plantpower healthymeals salt cleaneats minutes thenewhealth sea paleo cup sweet avocado grainfree cheese whatveganseat one cook garlic foodgrams olive pasta veggies sauce mbg hummus thefeedfeed kale recipe rice meal water like make potato dinner day week
3,body weight feel see way like look day life bodies healthy things real love photos skin one people happy make health good much every us let want self different someone change monday size image know get comments think something beauty never always week need others start post bad cellulite enough
4,food eating eat im recovery body like foods feel good get diet weight want really ed day healthy disorder one need make still know meal going dont health even think also people go today calories trying lot much meals shit cream something ate bad binge culture fucking would hungry better
5,day one time like also guys love get vegan new know today go good week happy first video food home best life make see going much made back got year definitely last really friends even always want fun holly right say super well think ever hope little date still yes
6,recovery edrecovery eatingdisorderrecovery meda us support haes antidiet recoveryispossible join pm hope group mentalhealth allfoodsfit link eatingdisorderawareness community bio eatingdisordersupport allbodiesaregoodbodies edawareness see free prorecovery live register edwarrior inspiration est selfcare come tonight mentalhealthawareness org week edfighter th allianceforeda intuitiveeating bodypositive medainc bodyrespect drop bodyimage healing event bopo eatingdisorder eatingdisorders
7,eating disorders support disorder us link help bio alliance health recovery care please treatment register today mental one community day join learn th meda national visit individuals awareness com notonemore call know struggling purpose services group free networking groups hope resources allianceforeatingdisorders virtual year conversation loved conference thank available nutrition
8,recoverwithmeda reads green meda graphic dietculture ditchthediet nondiet edrecovery bodytrust healthateverysize riotsnotdiets dietculturesucks description haes bodyrespect weightstigma allbodiesareworthybodies intuitiveeating sits antidietrevolution eatingdisorderrecovery thereisnowrongwaytohaveabody selfcompassion bodykindness joyfulmovement corner bopo bottom white mindfuleating recovery left body right edfighter eatingdisordersupport recoverysupport orange dietsdontwork text better logo background starts hand top blue prompts circle
