,top_terms
0,eat eating food body yourself being myself be life feel am get make day you is going to your things think always way about than do im just from can are youre me like because time not go ive out want by no dont back today with will have as
1,eating recovery eat disorders disorder binge weight yourself food body feel myself being day foods your you about to going be get ive am just over my youre is life think make of than from do im the by me as with have way will ed because can had all
2,recipe baking chocolate bake cookie flour sugar almond loaf butter cinnamon ingredients oats foodie oven syrup mix chips vegan glutenfree healthyfood make vanilla peanut grainfree coconut pan foodgrams pumpkin powder milk foodblogger blend paleo healthymeals healthyinspo avocado roasted stir protein batter banana maple bowl wellness let tbsp healthy oil mbg
3,feel yourself recovery myself being life be love own you your work get am through about ive im take doing do make go day going much by things think how youre time dont just my all world from is me want always but more way will to what of with
4,therapy therapist talk talking felt feel her being end over session shes things she think about be what back something get maybe say been your time of with had do want you going to after very from im how have did my more all will ok dont bit an was
5,travel going happy day live you definitely go australia hope life be get best im always am all ive days just about been home do very first as much your will what more love last are my to friends by is have good on some and this from time me
6,wear body beauty yourself feel look cellulite be bodies change being beautiful happy skin photos myself you your do than make always how get im love just day same about dont real want youre life as by image think will more if my is different not things way but only
7,inpatient hospital patients treatment day slept morning mood going anxious today feel doctor went room go be pretty been very good was ive groups friends bad had about nice great with headache how back well im staff didnt get okay so worse in better now spent wasnt got out were
8,veganfitness veganism veganfood vegansofig vegan vegangains crueltyfree veganpower diet bananagirldiet foodshare healthy healthynotskinny bananagirl freeleethebananagirl eating lifestyle fruitaddict fruitbats carbs eat carbthefuckup food plantbased compassion rawtil highcarblowfat raw fitness plant freelee make your hclf nature you frugitarian lowfat all ctfu it my its love day are girl is have about
9,adoption fostering babies child foster house birth children having home her baby shes family be care she bed back little go what been get went out very up to sleep after school am do time are if old so will with day how only is have as our about an
10,donate donation donations givehopeday support supportgroupssavelives care allianceforeatingdisorders hope provide community alliance fund group mentalhealth allianceforeda alliances groups lifesaving services give recovery grateful funds clinicianled struggling our you for free we on gift therapistled continue findedhelp all link thank us yourpathtorecovery be to will recoveryispossible need help here able weekly
11,yoga exercise fitness workout gym muscle muscles strength practice movement training body doing breath move am feel be life do out myself go about get try back working make is class your will how love can my down into way youre are dont after not with from no want home
12,covid vaccinated vaccine lockdown virus being government uk home going not visitors news how what no people doing we so cases with up because school been just weeks schools very will as get our has im when now about us trial countries like more the this have from time quite
13,running marathon run parkrun runs ran pace miles race rest doing training going feel plan fast do go been day minutes week get did had about garmin is evening think really legs am just you have km will over back because long im as myself not ive with was out
14,go get work sleep be feel im ur you going weed dont gonna do lol make hes my just if his is what ive room literally day all can about plants shit him no been life want only have are from myself time had an got how as its to
15,backstage sing songs song singing singer music musicians listening playlist going celebs coversong jonasbrothers do recovery bop selflove your live recording watch dont written you cover my wrote bass bops im all be would ur to this why our the very with ukulele love come who we just taylor comment
16,giveaway gift macrmike prize winners cookie contacted announced pm sale give card win eatswithclaire enter box partnered lucky winner mike share all aud endorsed macro your you entry extra free post my breeelenehan me am been excited have closes code closed on favorite easter and will one ive is th
