,top_terms
0,eating food eat body weight healthy disorder health diet calories foods lot binge control days recovery bad ate without meals exercise less better feeling needs hungry fat gain lose thing trying thoughts enough sometimes culture energy okay fear mental hard stop meal keep hunger though brain loss enjoy matter worth
1,support eating help disorders alliance please recovery disorder #edrecovery health mental link free community thank #notonemore share national call com awareness bio #allianceforeda #recovery hope visit individuals groups struggling give loved #mentalhealth #yourpathtorecovery join conversation allianceforeatingdisorders resources care giveaway reach journey alone #findedhelp services led month available head #eatingdisorderrecovery someone
2,home new first year last friends guys morning happy days best went little hope definitely night video fun ever yesterday run big full bit next lot getting weekend running family long pretty live super tomorrow thank work excited around bed sure yes hours evening christmas coming school amazing take come
3,therapy session bit talk therapist felt talking maybe last baby parents end hard thing thought trying asked though able quite tell away work years feeling told feels different child might part yes lot keep school next minutes mum sometimes try stuff done brain started difficult help talked feelings relationship come
4,cup chocolate add #glutenfree #healthyfood #foodie #foodblogger #healthyinspo #healthy tbsp #healthylife #healthymeals salt butter #plantpower #wellness powder minutes sea #cleaneats #thenewhealth #fitness mix bowl #foodgrams #paleo coconut oil vanilla #thefeedfeed ingredients maple recipe flour #mbg #grainfree syrup almond milk bake vegan peanut #whatveganseat pinch batter set baking pumpkin pan olive
5,bowl cream protein vegan meal breakfast cheese sweet plant dinner lunch topped favorite rice avocado eat roasted sauce chocolate pasta ice veggies frozen based morning milk smoothie toast meals oats water butter #vegan potato code banana egg pizza bread seeds food cooking delicious bowls #plantbased hummus plate simple oil salad
6,body self look happy take world change real someone feeling best live years beautiful different person work else skin enough start living social thing comments mind media photos care remember important purpose bodies hard happiness find post share reminder okay thoughts new monday joy human everything past grateful positive may
7,recovery shit fucking better hard gonna bad trying keep fuck take care work okay help lol try someone anyone getting anything ever friends hate sick literally inpatient wanna ass everything everyone nothing long lot stop enough nice put actually self art trauma give idk sorry alone pain great pretty god
