,top_terms
0,body look photos real happy skin bodies self image wear monday beautiful looks comments someone beauty change online different healthy size photo start enough positive media post thoughts wearing appearance mirror else ever thing cellulite around less mind #bodyimage best clothes leave social comfortable hope legs negative please kind years
1,eating food eat body weight disorder healthy recovery foods health calories diet binge lot bad meals ate without gain exercise brain meal less hungry fat lose needs thing control ed trying normal hunger culture sometimes enjoy okay actually enough keep loss number better days full yes energy matter instead stop
2,cup chocolate tbsp butter add flour mix ingredients powder #glutenfree vanilla #healthyfood bake coconut batter pinch #healthy minutes #foodie salt #foodblogger recipe #healthyinspo #healthylife set #healthymeals baking peanut bowl sea vegan maple #plantpower pan loaf sugar syrup almond cookie oil milk chips cinnamon blend #foodgrams banana #wellness #thefeedfeed #chocolate dough
3,#glutenfree #healthy #foodie #healthyfood #foodblogger #wellness #healthyinspo #healthylife #plantpower #healthymeals #fitness #cleaneats #thenewhealth bowl add #paleo salt #grainfree oil sea roasted #foodgrams #mbg cup minutes #whatveganseat #thefeedfeed cook olive powder garlic #vegan #vegans vegan recipe sweet water hummus tbsp kale diced maple #plantbased curry avocado used yogurt #vegetarian red milk
4,eating support alliance disorders please help recovery #edrecovery #notonemore disorder #allianceforeda link mental national #recovery com health call individuals free awareness visit thank community #mentalhealth #yourpathtorecovery allianceforeatingdisorders bio hope groups #findedhelp struggling conversation #eatingdisorderrecovery resources join #eatingdisorders loved #recoveryispossible #eatingdisorder care services watch alone led #quoteoftheweek head reach register virtual
5,bowl breakfast cream chocolate butter milk eat topped frozen protein meal almond oats cheese ice food smoothie sweet rice morning banana peanut pizza egg seeds avocado dinner lunch eggs bread eating sauce favorite coconut pasta fruit toast potato veggies recipe plate vanilla apple pancakes meals cacao chia cinnamon vegan half
6,therapy session bit talk therapist ok talking maybe last felt asked thought thing trying end hard able tell though might try quite lot told feeling yes mum years away brain feels keep work help part wanted stuff talked first sometimes next cake parents enough started sure feelings start difficult done
7,guys video new vegan definitely holly first vlog year yes ever please big ok bit best live thank ps uk hope youtube #vegan pretty food videos sure full channel amazing honestly yesterday super actually #veganfood literally #plantbased oh #nature coming next running try fun #raw whilst #girl #carbs stay already
8,plant free based vegan protein use code new date post solo giveaway tag give favorite share enjoy #ad fun recipes link macrmike bree using products follow skin book story order bio enter comments lil ad save stories mug check gift range perfect swipe cookies try excited friend winner full choc
9,home last days morning night went little happy friends first bed getting work run long hours feeling weekend sleep since though family house tomorrow baby rest school around yesterday weeks new felt evening bit fun great year lot next done take later walk christmas took running taking minutes come hour
10,school trauma treatment hospital uk parents inpatient family different staff child children white foster self care social covid unit kids baby doctor group age allowed safe vaccine patients team babies groups system harm state black god called news due schools contact part non use level medical privilege case etc nutrition
11,recovery ed shit fucking ur fuck gonna lol bc ever literally keep trying someone ass hate wanna better anything try take help stop anyone hard sick idk blog sorry actually care bad nothing give money ill put everything post gotta work art getting everyone else pro enough maybe guess cool
12,self take world years feeling best work hard lot care new live past help year person better change happy come everything thing sometimes hope remember find someone health okay thought living feels enough keep share little grateful taking look around else trying place mind long days different felt friends everyone
