,corpus,topicID,technique,Input.topn,Input.doc1,Input.doc2,Input.doc3,Input.doc4,Input.doc5,biased,coherence,consensus,contentious,expected,insightful,meaningful,offensive,preferable,sensible,specificity,uncanny,unpredictable,confusing,bestlabel,familiarity,suitable,objectionable,consensus_factor,NPMI_3,NPMI_6,NPMI
30,asd,19,TopN,"children, canada, government, treatment, care, services","<br />December 31 2010 <br /> <br />The Honourable David Alward  <br />Premier of New Brunswick and Minister <br />Responsible for the Premier's Council  <br />on the Status of Disabled Persons <br /> <br />The Honourable Madeleine Dub  <br />Minister of Health  <br /> <br />The Honourable Sue Stultz <br />Minister of Social Development  <br /> <br />The Honourable Jody Carr <br />Minister Education and Early Childhood Development <br /> <br />Dear Honourable Premier and Honourable Ministers <br /> <br /> Re: Adult Autism Residential Care and Treatment in New Brunswick 2000-2010 and Beyond; In 2011 Will Autistic Adults Remain Forgotten?  <br /> <br /> As this year draws to an end and a new year approaches I  congratulate you on your victory in the recent election; on winning the trust of the people of New Brunswick.  In facing up to the well known financial and economic challenges confronting New Brunswickers I hope, and trust, that this government will not neglect  the eduction, health and social needs of New Brunswickers,  of all New Brunswickers, including NB adults with autism disorders.  In particular I hope, and ask in this open letter, that  this government begin serious efforts in 2011 to address the residential care and treatment needs of New Brunswick adults with autism disorders.   <br /> I am the father of a 14 year old boy with Autistic Disorder, assessed with profound developmental delays."," <br /> <br /> <br /> We can do much, much better.  <br /> <br /> <br /> We need an enhanced group home system throughout the province in which homes would be linked directly to a major centre that could provide ongoing training, leadership and supervision.  <br /> <br /> <br /> That major centre could also provide services for those who are mildly affected as well as permanent residential care and treatment for the most severely affected.  <br /> <br /> <br /> Such a secure centre would not be based on a traditional ""hospital"" model but should, itself, be integrated into the community in a dynamic manner, possibly as part of a private residential development.  <br /> <br /> <br /> The focus must be on education, positive living experiences, and individualized curricula."," I respectfully ask each of you to consider this request for adult autism residential care and treatment and provide a direct response.  <br /> <br /> <br />Prior to the commencement of the official election period early autism intervention issues have already received some needed attention in a new early intervention policy which provoked considerable reaction and vigorous discussion.  What was not mentioned, what has never been mentioned, what never gets any serious attention, is the desperate need for an adult autism centre that could assist in providing providing ongoing training, leadership and supervision for adult autism group homes and assisted living arrangements and would also provided permanent residential care and treatment for those with severe autism disorders.   <br /> <br /> <br /> <br />The significant changes that occurred in early intervention and autism education in this province happened in direct response to strong parent advocacy primarily from parents with Autism Society New Brunswick.  In our efforts we always sought credible evidence based services."," Ms May  will the Green Party of  Canada  follow up on the  Shawn Muphy  autism motion by also seeking amendment of the  Canada Health Act  to require  ABA treatment  for autism?  I received no reply to my question.  Autistic children in Canada do not need another federal bureaucracy to study autism and""better inform Canadians as promoted by Autism Canada.    The Green Party of Canada, with no specific autism platform at present, has shown interest in Autism Canada style bureaucracy building but no interest in actually taking real action to help autistic children in Canada receive effective treatment wherever they live.  The Green Party, like the Conservative Party, will not be receiving this autism dad's vote in this election.","<br /> <br /> <br /> <br /> <br /> <br />There is currently a group receiving money from the Harper government, purportedly to develop a ""National Autism Strategy"".  It is an election year handout from a government which has consistently opposed a meaningful role for the federal government in ensuring that autistic children and adults in Canada receive the treatment and services they need to live meaningful, healthy lives.   <br /> <br /> <br /> <br />Parents in Canada have fought for many years with varying levels of success for government coverage of evidence based ABA treatment for autism disorders.  In 2006 former Charlottetown MP Shawn Murphy articulated a REAL National Autism Strategy when he introduced Bill C-304 which was defeated by a Harper Conservative-Bloc Quebecois coalition vote.   <br /> <br /> <br /> <br /> <br /> <br /> <br /> <br />L: Former Charlottetown MP Shawn Murphy <br /> <br />C: NB Senator Jim Munson <br /> <br />R: Late Fredericton MP Andy Scott <br /> <br />3 Strong Advocates for a National Autism Strategy <br /> <br /> <br /> <br />Federal politiicans and subservient autism charities should stop pretending and stop yakking about a National Autism Strategy if they do not intend to adopt the REAL National Autism Strategy proposed in 2006 in Shawn Murhpy's Bill C-304: <br /> <br /> <br /> C-304 <br /> <br /> <br /> <br /> <br /> <br />First Session, Thirty-ninth Parliament, <br />55 Elizabeth II, 2006 <br /> <br /> <br /> <br /> HOUSE OF COMMONS OF CANADA <br /> BILL C-304 <br /> <br />_____________________________________________ <br /> <br />FIRST READING, MAY 17, 2006 <br /> <br />_____________________________________________ <br /> <br /> MR.",16.6,73.8,71.8,29.4,81.4,69.2,75.8,8.2,71.8,75.8,45.8,24.6,23.0,21.0,,33.6,322.1640171723372,79.73233264185359,35.65463821804332,-0.004568106637705634,0.06284030302548443,0.0291360981938894
31,asd,21,TopN,"aba, children, treatment, intervention, therapy, behavior","    These reflect clinically-significant quality of life improvements.  While studies varied as to the    magnitude of gains, all have demonstrated long term retention of gains made.    Other major contributions of ABA to the education and treatment of individuals with  autism     include:          a large number of empirically-based systematic instruction methods that lead to the        acquisition of skills, and to the decrease/elimination of aberrant behaviors;            a technology for systematically evaluating the efficacy of interventions intended to affect       individual learning and behavior; and           substantial cost/benefit.        Over 30 years of rigorous research and peer review of applied behavior analysis effectiveness    for individuals with  autism  demonstrate ABA has been objectively substantiated as effective    based upon the scope and quality of science.  Professionals considering applied behavior   analysis should portray the method as objectively substantiated as effective.","<br /> <br /> <br /> <br /> <br /> <br />Research to date benefiting persons suffering from autism disorders can be summed up in two words:  Lovaas , ABA.  The work done by Dr.  Ivar Lovaas has been applied successfully for decades as reported by the US Surgeon General's office (1999) and by the American Academy of Pediatrics (2007), reaffirmed (2010): <br /> <br /> <br /> <br /> <br /> <br /> The effectiveness of ABA-based intervention in ASDs has been well documented through 5 decades of research by using single-subject methodology21,25,27,28 and in controlled studies of comprehensive early intensive behavioral intervention programs in university and community settings. 2940 Children who receive early intensive behavioral treatment have been shown to make substantial, sustained gains in IQ, language, academic performance, and adaptive behavior as well as some measures of social behavior, and their outcomes have been significantly better than those of children in control groups.","<br /> <br /> <br /> <br /> <br />An article in the January 13, 2014 issue of the Canadian Medical Association Journal,  Autism spectrum disorder: advances in evidence-based practice ,  confirms what American authorities have told us for decades, from the US Surgeon General to MADSEC and the American Academy of Pediatrics, ABA still represents evidence based, effective best treatment practice while "" Research on non-ABAbased treatments is sparse and shows limited efficacy."" : <br /> <br /> <br /> <br /> Autism spectrum disorder: advances in evidence-based practice <br /> <br /> <br /> <br /> ""What treatments and interventions are available, and are they effective?  The goal of existing interventions is to facilitate the acquisition of skills, remove barriers to learning and improve functional skills and quality of life.  <br /> <br /> <br /> <br /> Behavioural interventions <br /> <br /> <br /> <br /> Current best practices for preschool-aged children with ASD include a focus on improving language, cognitive and adaptive skills using applied behaviour analysis (ABA) techniques. 58 Applied behaviour analysis refers to the application of empirically derived learning principles(i."," Methods of applied behavior analysis should be considered to evaluate the effectiveness of any intervention used to help individuals with autism.  Researchers should continue to vigorously investigate behavioral intervention as the most promising area of research and treatment benefiting individuals with autism known today.  Early interventionists should leverage early autism diagnosis with The  American Academy of Pediatrics  Management of Children with Autism Spectrum Disorders (2007)   report described the level of evidence of ABA effectiveness in a manner that no other treatment mentioned in the report even remotely approximated: Applied Behavior Analysis Applied behavior analysis (ABA) is the process of applying interventions that are based on the principles of learning derived from experimental psychology research to systematically change behavior and to demonstrate that the interventions used are responsible for the observable   improvement in behavior.  ABA methods are used to increase and maintain desirable adaptive behaviors, reduce interfering maladaptive behaviors or narrow the conditions under which they occur, teach new skills, and generalize behaviors to new environments or situations.  ABA focuses on the reliable measurement and objective evaluation of observable behavior within relevant settings including the home, school, and community.","12 <br /> <br /> <br /> 2.  American Academy of Pediatrics - Management of Children with Autism Spectrum Disorders ,  (2007, reaffirmed 2010) <br /> <br /> The American Academy of Pediatrics article M anagement of Children With Autism Spectrum Disorders , Scott<br />M.  Myers, MD, Chris Plauch Johnson, MD, MEd, the Council on Children with Disabilities (2007), reaffirmed (2010): <br /> <br /> <br /><br /> <br /> <br /> ""Applied Behavior Analysis <br /> <br /><br /> <br /> <br /> <br /> <br /><br /> <br /> <br /> Applied behavior analysis (ABA) is the process of<br />applying interventions that are based on the principles of learning derived<br />from experimental psychology research to systematically change behavior and to<br />demonstrate that the interventions used are responsible for the observable<br />improvement in behavior.  ABA methods are used to increase and maintain<br />desirable adaptive behaviors, reduce interfering maladaptive behaviors or<br />narrow the conditions under which they occur, teach new skills, and generalize<br />behaviors to new environments or situations.  ABA focuses on the reliable<br />measurement and objective evaluation of observable behavior within relevant<br />settings including the home, school, and community.",31.4,74.2,68.0,41.6,67.6,63.2,74.2,22.4,72.0,73.6,35.2,29.2,28.4,35.2,,25.4,302.107083321666,105.51223230276,33.76762393909396,0.0153695037527952,0.11309028290107627,0.06422989332693574
32,asd,38,TopN,"told, asked, went, time, got, back"," <br /> Two friends <br />at the table were crying hard <br />and another was so brave, <br />he said <br />he was left all alone <br />once <br />and  didnt even cry .  <br /> Miles didnt say a word to that <br />but his eyes said his wheels were <br /> turning.  <br /> <br /> It was time to line up and head to class and so <br />I bent to hug him and bit back tears <br />and he made his <br /> MOOOOM <br />face <br />and bit back a smile.  <br /> I didnt make it back to the van, <br />sob-walking <br />and then sob-driving.  <br /> I was left all alone <br /> and I did cry."," <br /> <br />""Hey,"" I called out to him.  ""Why is it that I'm carrying everything and you're carrying nothing?""  <br /> <br />Bud spun around and made his way back to me.  ""I don't know,"" he said.  <br /> <br />""How exactly did this happen?""","  hmmmm....   I thought,  fiveis a weird number...  <br /> <br /> <br />Sure enough, a sixth and seventh deer came into view and stood with #4.  They seemed to be taking a long time to decide if they wanted to join the first four, or head off on their own.  <br /> <br />It was deer #4 that spoke to me, the one that knew which direction it wanted to go, but was overly concerned about everyone else..."," I watched him while I kept working, and let him have his look.  Im just glad I took the cobwebs down first, because he looked  everywhere .  Hed made his way around my five bookcases and was coming back to take a better look at my desk & table workstation when Mark opened the door.  <br /> I came to get Alex, he said.  He seemed a little surprised to see that I was fine with Alex being in my den."," <br /> <br />Yes, he went, but not before throwing his bike on the ground and his helmet across the driveway.  <br /> <br />Yes, I took his cell phone.  <br /> <br />Yes, I told him Flicka could not hang out with him while he spent 35 minutes in his room.  <br /> <br />Yes, I told him  if  the ice cream truck  did come, he would not be buying any.  <br /> <br />Yes, that was what broke him.",21.0,46.2,50.2,63.2,38.8,43.0,51.0,7.4,41.0,49.2,33.2,36.6,48.0,54.2,,24.6,195.41462132754333,101.62625123782776,24.928451790331128,0.09609157239363046,0.08364995743058856,0.08987076491210952
33,gunn,7,TopN,"heylyn, rogers, rochester, hall, homer, mary"," Monday.  Finished drawing.  To town<br />with Heylyn; got note from Canada railroad<br />man inclosing tickets.  Tried Rogers office, he<br />out.  To Heylyns store."," Sunday.  Continuation of the Gleason hoax, it waxing immense & comprehensive in progress.  A letter from an imaginary John Voorhees, dweller in a Church<br />Street brothel, complimenting Gleason on his roaring Sonnet, intimating that as<br />he was going in strong into the smutty line, he sent him something he must own<br />was first chap, (an acrostic which I think boasts Rochesters authorship. ) Also<br />stating the willingness of John Vorhees to supply tales with hair on at $5 a<br />column, also demanding an agency for the sale of French cards and prints  as<br />doubtless Gleason had a first rate stock on hand.  This Barth wrote."," R.  attributes her convalescence.  To Heylyns shop, loafing there with<br />him till dinner-time.  At his house all the<br />afternoon, loafing, chaffing and drawing<br />his piseatorial caricatures for the decoration of<br />his shop, to his great satisfaction.  It appeared that among other characteristics of Mrs."," Rain, clearing up as Rogers drove<br />me to the city.  Goodbye to him.  To Heylyns fishing<br />tackle shop, where he came by 1.  P.  M."," Tiltons had his meals ins own room of late, for this ludicrous<br />reason.  He brought home a little terrier pup, which the boy Dobson made<br />much of;  the animal being in the room as wont of an evening, at the supper<br />table, Alf takes him up and lets him lap up milk out of his saucer. <br />Mason smiles depreciatingly, poor, tall, sick looking Mrs Tilton smiles,<br />Homer looks in hard astonishment, Boggs gets intensely red in the face,<br />(as he always does on the smallest provocation), and nudges his little, quaint,<br />good-tempered, affectionate wife to see.  Suddenly Tilton rises, quits his<br />supper and hurrys away from the room.  Little Dob glides round full<br />of intense spite, collars the dog, and with a Mr Waud, there are<br />limits to every thing   puts puppy out of the room.",43.8,71.6,71.2,63.6,69.8,53.6,66.2,32.8,63.4,63.6,60.6,35.6,41.6,36.2,,31.2,278.147743384189,155.05619362382373,35.35668859505134,0.03127067296632644,0.025574951698113628,0.028422812332220035
34,gunn,8,TopN,"drawing, called, town, lantern, reveille, till"," I to Sachem Office.  To Engravers, Post Office<br />&c.  Waited till 1, got Picayune & Reveille cuts,<br />& to the several Offices.  Saw Mathews, (oily, shifty,<br />dodging Mathews! ) To Reveille Office."," Sketched a certain store, all<br />signs and pictures, returned at sunset.  Met Fagan. <br />To supper  then to room.  Joe came.  Drawing<br />all the evening and now, to bed.","<br />Reveille Office.  Returned by 1 1/2, dined at Reade Street.  Work<br />on by Reveille cut; supped down town, drawing again till Joe<br />came.  Out with him about 10 1/2, took him to Bowery, had<br />Ice creams, saw him to Mulbery Street, then walked back to<br />my room, down Broadway.  Barth had called at my room<br />leaving note.","13.  Tuesday.  Made drawing on wood for Lantern.  Took it.  Brougham, Caroll &<br />Powell.","17.  Tuesday.  Down town, Goslings, Post Office, Lantern Office,<br />there some time, Butler, Powell, Bellew & others there.  To Wells<br />& Webb for of blocks.  To Mathews, return to room, drawing.",47.4,53.8,54.8,67.4,60.0,49.0,59.0,41.6,50.8,66.4,42.4,45.6,31.0,34.4,,11.4,247.63173094398138,162.3679218608846,27.212732233269843,-0.010068644419607488,-0.036788483698626875,-0.023428564059117182
35,gunn,9,TopN,"book, welden, picayune, forbes, paper, cuts","028<br />  on hand 351<br /> given away 120 471<br /> sold 1,557<br /><br />PRINTING OFFICE, NO.  15 VANDEWATER STREET. <br /> New York Jan 1st 1858<br /><br />[handwritten_by_Gunn]<br />I hereby certify that from <br />the 1st 1857 to date I have<br />had the uninterrupted possession of the Stereo Plates of<br />the Book called Physiology <br />of New York Boarding Houses<br />and that during that time I<br />have printed from them 2000<br />copies, and no more. <br /> C.  A."," as usual.  I do now, in<br />part, let go my opinion, hold it no longer as to the<br />management of the paper, and suppose it to be just as<br />its projector wishes, and that he has some ulterior<br />purpose or backers in a pecuniary sense.  Forbes<br />knows no more than I, and is probably engaged as<br />an ostensible authority, Russell not wishing  as he<br />intimated on my engagement  to appear openly in connection with the paper.  (He has other offices in the<br />building and is said to be engaged, largely in the<br />telegraphing business.  These rooms, we newspaper<br />employees dont go in) The printers are all Englishmen, the foremans name appearing as publisher<br />of the paper."," Thursday.  Down town.  Bellew<br />came at night, and Colonel Forbes  who spake<br />of securing my services on the European, a newly<br />started paper.  Went home with Bellew, and<br />stayed till 11. <br /> 101.","15.  Saturday.  To Post-Office, Radways, and<br />the Stereotypers in Beekman St.  In the evening<br /> 171. <br />called on Mr and Mrs Andreotti."," Rain; rode<br />uptown.  Evening, round to Arnolds, with him, Sears and a<br />fellow boarder.  I was introduced to Herbert in 1849, on coming to this country, at Stringer and Townsends the publishers.  Having seen a portrait of Ned Buntline<br />and not knowing the fellows character, I fancied Herbert the<br />man and thinking the recognition might be a compliment (! )<br />said so!",34.6,55.0,59.0,46.6,57.8,62.0,71.0,35.6,64.0,58.8,39.4,49.0,36.6,49.0,,17.0,260.8241129326604,136.77473571920075,29.29837959421389,0.022620895722444134,0.0340444971662063,0.028332696444325216
36,gunn,11,TopN,"watson, edge, glover, powell, rawlings, notes"," Talk about<br />it.  Round to the Bank.  Thad Glover, foolish-fa-ced Thad Glover, and Watson, once of the Sunday<br />Courier, now of Porters Spirit there and Bob Gun must<br />needs invite them to drink with and join us.  This Watson, the odious little cub, I have put down particulars<br />of, heretofore.  He did some knavery in England, theft,<br /> 179<br />breach of trust or forgery, which necessitated<br />his flying hither and adoption of his present feigned<br />name."," Shees attention to the printed notice on<br />the door of his room, cautioning parties against<br />leaving money in their trunks, on account of<br />the number of hotel thieves that were about. <br />Mr.  Shee did not much like the idea of Watsons<br />taking the notes away, and was about to object, when<br />Watson, who by this time had closed the door, opened<br />it again, and poking in his head, asked Shee what kind<br />of funds he would like.  Mr.  Shee replied that he<br />must have bankable funds.","<br />We kept it up till midnight, when Billington<br /> 207<br />having taken himself off and Boweryem having gone<br />to bed, Edge and I turned out for aw oyster-stew.  (He had brought up for my future use,<br />sundry envelopes, directed in bigger than studhorse type to the London Star.  Returning<br />alone and looking into Cahills room, I found<br />him, Watson, Jewitt and Gufferoe.  Stayed<br />an hour hearing Cahill and Watson sing songs. <br />And thus passed my thirty-sixth birth-day."," (Children can be and commonly were,<br />just as big hypocrites as grown<br />people. ) Rawlings himself (I must put him in)<br />the perfect development of a peculiar stock, is a<br />man of middle size and stature, not particularly<br />noticeable in any respect, his face not ill-looking<br />but certainly not handsome.  His hair thinnish,<br />his eyes of a dubious blue-gray, his face without<br />much color, his side-whiskers not luxuriant,<br />his scanty mustaches waxed or gummed at the<br />ends into little upward curls, his chin clean shaven, the general expression of his countenance<br />equivocal  furtively uneasy and suggestive of<br />his nature as it were  Rawlings, could he<br />be quiet, might be mistaken for a respectable<br />man, being in truth the biggest humbug and<br />social imposter I have ever encountered.  Indeed<br />the whole family were evidently of the same kidney, Guss marriage <br />having, afforded a home to <br />all of them.  A human cuckoo himself  not<br />to say a bird of prey  he has brought all his<br />brood to occupy the remarkably snug nest in<br />which the pretty sparrow who accepted him,<br /> 37<br />Mrs."," He told me that old<br />Charles died twelve months ago; that previously<br />he (Charles) had experienced an awful exposure<br />and shaming, in a court of justice, about certain<br />log-rolling, jobbing, political corruptions into,<br />which the once owner of the Reveille had been betrayed.  Whitely attributed his death to this wretched business.  He had, too, the usual stories<br />to tell about old Powell, involving borrowing, sponging, dodging and lying, both at his (Whitelys)<br />own expense and that of his friends, into whose<br />acquaintance Powell contrived to hook himself. <br />Tired, at length, of lending the old dodger money;<br />of presenting orders on Frank Leslie for payment,<br />which were denied by Wood and others, Whitely<br />told Powell his sentiments on board on Hoboken<br />ferry-boat, when the elderly shyster assumed the<br />bully and  disappeared into the water-closet, remaining there while Whitely was on board!  All<br />Powells stories about Leigh Hunt, Wordsworth<br />and others, Whitely listened to, as to an acknowled and privileged liar.",23.2,47.0,61.4,62.6,47.4,45.2,46.2,13.4,45.0,49.8,35.8,26.6,42.8,45.2,,30.8,201.72134468985809,102.54482988039305,30.490178086181903,0.007879740323332805,0.01973967308345527,0.013809706703394037
